{
  "schemaVersion": 2,
  "project": "LatNe",
  "inventoryVersion": 1,
  "status": "draft",
  "updated": "2026-09-30",
  "scope": "javascript-typescript-syntax",
  "note": "Kandidātu inventārs. Katra termina statuss un latviskais variants tiek pārvaldīts individuāli.",
  "sources": [
    {
      "id": "mdn-js-lexical",
      "title": "MDN JavaScript Lexical grammar",
      "url": "https://developer.mozilla.org/en-US/docs/Web/JavaScript/Reference/Lexical_grammar",
      "checked": "2026-09-30"
    },
    {
      "id": "typescript-scanner-main",
      "title": "TypeScript compiler scanner",
      "url": "https://github.com/microsoft/TypeScript/blob/main/src/compiler/scanner.ts",
      "checked": "2026-09-30"
    }
  ],
  "terms": [
    {
      "order": 1,
      "id": "term-await",
      "source": "await",
      "layers": [
        "javascript"
      ],
      "kind": "keyword",
      "category": "async",
      "status": "approved",
      "latvian": "gaidi",
      "suggestions": [],
      "rejectedVariants": [],
      "notes": "",
      "sourceRefs": [
        "mdn-js-lexical",
        "typescript-scanner-main"
      ]
    },
    {
      "order": 2,
      "id": "term-break",
      "source": "break",
      "layers": [
        "javascript"
      ],
      "kind": "keyword",
      "category": "control",
      "status": "approved",
      "latvian": "beidz",
      "suggestions": [],
      "rejectedVariants": [],
      "notes": "",
      "sourceRefs": [
        "mdn-js-lexical",
        "typescript-scanner-main"
      ]
    },
    {
      "order": 3,
      "id": "term-case",
      "source": "case",
      "layers": [
        "javascript"
      ],
      "kind": "keyword",
      "category": "control",
      "status": "approved",
      "latvian": "kad",
      "suggestions": [],
      "rejectedVariants": [],
      "notes": "",
      "sourceRefs": [
        "mdn-js-lexical",
        "typescript-scanner-main"
      ]
    },
    {
      "order": 4,
      "id": "term-catch",
      "source": "catch",
      "layers": [
        "javascript"
      ],
      "kind": "keyword",
      "category": "error",
      "status": "approved",
      "latvian": "ķer",
      "suggestions": [],
      "rejectedVariants": [],
      "notes": "",
      "sourceRefs": [
        "mdn-js-lexical",
        "typescript-scanner-main"
      ]
    },
    {
      "order": 5,
      "id": "term-class",
      "source": "class",
      "layers": [
        "javascript"
      ],
      "kind": "keyword",
      "category": "declaration",
      "status": "approved",
      "latvian": "klase",
      "suggestions": [],
      "rejectedVariants": [],
      "notes": "apstiprinu tiešu tulkojumu",
      "sourceRefs": [
        "mdn-js-lexical",
        "typescript-scanner-main"
      ]
    },
    {
      "order": 6,
      "id": "term-const",
      "source": "const",
      "layers": [
        "javascript"
      ],
      "kind": "keyword",
      "category": "declaration",
      "status": "approved",
      "latvian": "nemainīgs",
      "suggestions": [],
      "rejectedVariants": [],
      "notes": "",
      "sourceRefs": [
        "mdn-js-lexical",
        "typescript-scanner-main"
      ]
    },
    {
      "order": 7,
      "id": "term-continue",
      "source": "continue",
      "layers": [
        "javascript"
      ],
      "kind": "keyword",
      "category": "control",
      "status": "approved",
      "latvian": "turpini",
      "suggestions": [],
      "rejectedVariants": [],
      "notes": "",
      "sourceRefs": [
        "mdn-js-lexical",
        "typescript-scanner-main"
      ]
    },
    {
      "order": 8,
      "id": "term-debugger",
      "source": "debugger",
      "layers": [
        "javascript"
      ],
      "kind": "keyword",
      "category": "debug",
      "status": "approved",
      "latvian": "atkļūdo",
      "suggestions": [],
      "rejectedVariants": [],
      "notes": "",
      "sourceRefs": [
        "mdn-js-lexical",
        "typescript-scanner-main"
      ]
    },
    {
      "order": 9,
      "id": "term-default",
      "source": "default",
      "layers": [
        "javascript"
      ],
      "kind": "keyword",
      "category": "control",
      "status": "approved",
      "latvian": "noklusējums",
      "suggestions": [],
      "rejectedVariants": [],
      "notes": "",
      "sourceRefs": [
        "mdn-js-lexical",
        "typescript-scanner-main"
      ]
    },
    {
      "order": 10,
      "id": "term-delete",
      "source": "delete",
      "layers": [
        "javascript"
      ],
      "kind": "keyword",
      "category": "operator-word",
      "status": "approved",
      "latvian": "dzēs",
      "suggestions": [],
      "rejectedVariants": [],
      "notes": "",
      "sourceRefs": [
        "mdn-js-lexical",
        "typescript-scanner-main"
      ]
    },
    {
      "order": 11,
      "id": "term-do",
      "source": "do",
      "layers": [
        "javascript"
      ],
      "kind": "keyword",
      "category": "control",
      "status": "approved",
      "latvian": "veic",
      "suggestions": [],
      "rejectedVariants": [],
      "notes": "",
      "sourceRefs": [
        "mdn-js-lexical",
        "typescript-scanner-main"
      ]
    },
    {
      "order": 12,
      "id": "term-else",
      "source": "else",
      "layers": [
        "javascript"
      ],
      "kind": "keyword",
      "category": "control",
      "status": "approved",
      "latvian": "citādi",
      "suggestions": [],
      "rejectedVariants": [],
      "notes": "",
      "sourceRefs": [
        "mdn-js-lexical",
        "typescript-scanner-main"
      ]
    },
    {
      "order": 13,
      "id": "term-export",
      "source": "export",
      "layers": [
        "javascript"
      ],
      "kind": "keyword",
      "category": "module",
      "status": "approved",
      "latvian": "eksportē",
      "suggestions": [],
      "rejectedVariants": [],
      "notes": "",
      "sourceRefs": [
        "mdn-js-lexical",
        "typescript-scanner-main"
      ]
    },
    {
      "order": 14,
      "id": "term-extends",
      "source": "extends",
      "layers": [
        "javascript"
      ],
      "kind": "keyword",
      "category": "class",
      "status": "approved",
      "latvian": "paplašina",
      "suggestions": [],
      "rejectedVariants": [],
      "notes": "",
      "sourceRefs": [
        "mdn-js-lexical",
        "typescript-scanner-main"
      ]
    },
    {
      "order": 15,
      "id": "term-false",
      "source": "false",
      "layers": [
        "javascript"
      ],
      "kind": "literal",
      "category": "literal",
      "status": "approved",
      "latvian": "nepatiess",
      "suggestions": [],
      "rejectedVariants": [],
      "notes": "",
      "sourceRefs": [
        "mdn-js-lexical",
        "typescript-scanner-main"
      ]
    },
    {
      "order": 16,
      "id": "term-finally",
      "source": "finally",
      "layers": [
        "javascript"
      ],
      "kind": "keyword",
      "category": "error",
      "status": "approved",
      "latvian": "beigās",
      "suggestions": [],
      "rejectedVariants": [],
      "notes": "",
      "sourceRefs": [
        "mdn-js-lexical",
        "typescript-scanner-main"
      ]
    },
    {
      "order": 17,
      "id": "term-for",
      "source": "for",
      "layers": [
        "javascript"
      ],
      "kind": "keyword",
      "category": "control",
      "status": "approved",
      "latvian": "kam",
      "suggestions": [],
      "rejectedVariants": [],
      "notes": "",
      "sourceRefs": [
        "mdn-js-lexical",
        "typescript-scanner-main"
      ]
    },
    {
      "order": 18,
      "id": "term-function",
      "source": "function",
      "layers": [
        "javascript"
      ],
      "kind": "keyword",
      "category": "declaration",
      "status": "approved",
      "latvian": "darbība",
      "suggestions": [],
      "rejectedVariants": [],
      "notes": "",
      "sourceRefs": [
        "mdn-js-lexical",
        "typescript-scanner-main"
      ]
    },
    {
      "order": 19,
      "id": "term-if",
      "source": "if",
      "layers": [
        "javascript"
      ],
      "kind": "keyword",
      "category": "control",
      "status": "approved",
      "latvian": "ja",
      "suggestions": [],
      "rejectedVariants": [],
      "notes": "",
      "sourceRefs": [
        "mdn-js-lexical",
        "typescript-scanner-main"
      ]
    },
    {
      "order": 20,
      "id": "term-import",
      "source": "import",
      "layers": [
        "javascript"
      ],
      "kind": "keyword",
      "category": "module",
      "status": "approved",
      "latvian": "importē",
      "suggestions": [],
      "rejectedVariants": [],
      "notes": "",
      "sourceRefs": [
        "mdn-js-lexical",
        "typescript-scanner-main"
      ]
    },
    {
      "order": 21,
      "id": "term-in",
      "source": "in",
      "layers": [
        "javascript",
        "typescript"
      ],
      "kind": "keyword",
      "category": "operator-word",
      "status": "approved",
      "latvian": "iekš",
      "suggestions": [],
      "rejectedVariants": [],
      "notes": "",
      "sourceRefs": [
        "mdn-js-lexical",
        "typescript-scanner-main"
      ]
    },
    {
      "order": 22,
      "id": "term-instanceof",
      "source": "instanceof",
      "layers": [
        "javascript"
      ],
      "kind": "keyword",
      "category": "operator-word",
      "status": "approved",
      "latvian": "pieder",
      "suggestions": [],
      "rejectedVariants": [],
      "notes": "",
      "sourceRefs": [
        "mdn-js-lexical",
        "typescript-scanner-main"
      ]
    },
    {
      "order": 23,
      "id": "term-let",
      "source": "let",
      "layers": [
        "javascript"
      ],
      "kind": "keyword",
      "category": "declaration",
      "status": "approved",
      "latvian": "lai",
      "suggestions": [],
      "rejectedVariants": [],